{"schema_version":"1.0.0","request_id":"abk:run-request:artifact-dag-core-v1-control-spc-03-recovery-rollback-r1","campaign_id":"abk:benchmark-campaign:artifact-dag-core-v1","branch":"control","case_id":"SPC-03-recovery-rollback","repeat":1,"fixture":{"relative_path":"fixtures/SPC-03-recovery-rollback.json","sha256":"ce339295134d2036f96615accc8d1e1e9f7a5fd4c73821b9fab2c868cb0fefaa"},"contracts":{"campaign_relative_path":"../../../../../campaign.json","campaign_sha256":"471b4f31608781205ce71d497add92d15659003a2a5852f1cc7fb59330b320d3","schema_relative_path":"../../../../../../../schemas/benchmark-campaign.schema.json","schema_sha256":"b4cacc60fe730faab91595f3f00b73ddf8729b494413a5eab5fa295e494b8aff"},"run":{"run_id":"abk:run:artifact-dag-core-v1-control-spc-03-recovery-rollback-r1","relative_run_root":"runs/full-campaign-20260805/SPC-03-recovery-rollback/control/R1","timeout_seconds":150,"stop_condition_id":"full-campaign-case-oracle"},"authority":{"read_roots":["campaign","fixture","schema"],"write_root":"run","network":false,"credentials":false,"production_resources":false,"external_writes":false,"git_mutation":false,"process_spawn":false},"environment":{"HOME":"env/HOME","USERPROFILE":"env/USERPROFILE","APPDATA":"env/APPDATA","LOCALAPPDATA":"env/LOCALAPPDATA","XDG_CONFIG_HOME":"env/XDG_CONFIG_HOME","XDG_DATA_HOME":"env/XDG_DATA_HOME"},"runner":{"contract_version":"control-runner-v1","executable_sha256":"a0e4929d124c831035546c8c65a1de7618da789d05a4bb24b645285421e859c1","host":"codex"}}