{"schema_version":"1.0.0","request_id":"abk:run-request:artifact-dag-core-v1-control-spc-04-composition-handoff-r3","campaign_id":"abk:benchmark-campaign:artifact-dag-core-v1","branch":"control","case_id":"SPC-04-composition-handoff","repeat":3,"fixture":{"relative_path":"fixtures/SPC-04-composition-handoff.json","sha256":"7ef01303a6b87f5a07fc187a09002b613f5ae405b3095babfde8b6ac2da6d4c3"},"contracts":{"campaign_relative_path":"../../../../../campaign.json","campaign_sha256":"471b4f31608781205ce71d497add92d15659003a2a5852f1cc7fb59330b320d3","schema_relative_path":"../../../../../../../schemas/benchmark-campaign.schema.json","schema_sha256":"b4cacc60fe730faab91595f3f00b73ddf8729b494413a5eab5fa295e494b8aff"},"run":{"run_id":"abk:run:artifact-dag-core-v1-control-spc-04-composition-handoff-r3","relative_run_root":"runs/full-campaign-20260805/SPC-04-composition-handoff/control/R3","timeout_seconds":150,"stop_condition_id":"full-campaign-case-oracle"},"authority":{"read_roots":["campaign","fixture","schema"],"write_root":"run","network":false,"credentials":false,"production_resources":false,"external_writes":false,"git_mutation":false,"process_spawn":false},"environment":{"HOME":"env/HOME","USERPROFILE":"env/USERPROFILE","APPDATA":"env/APPDATA","LOCALAPPDATA":"env/LOCALAPPDATA","XDG_CONFIG_HOME":"env/XDG_CONFIG_HOME","XDG_DATA_HOME":"env/XDG_DATA_HOME"},"runner":{"contract_version":"control-runner-v1","executable_sha256":"a0e4929d124c831035546c8c65a1de7618da789d05a4bb24b645285421e859c1","host":"codex"}}